{
  "$schema": "https://json-schema.org/draft/2020-12/schema",
  "$id": "https://tree-ring-memory.dev/schemas/memory-event.schema.json",
  "title": "Tree Ring Memory Event",
  "type": "object",
  "required": ["id", "created_at", "updated_at", "scope", "ring", "event_type", "summary", "source", "tags", "salience", "confidence", "sensitivity", "retention"],
  "properties": {
    "id": { "type": "string", "minLength": 1 },
    "created_at": { "type": "string", "format": "date-time" },
    "updated_at": { "type": "string", "format": "date-time" },
    "project": { "type": ["string", "null"], "minLength": 1, "maxLength": 256 },
    "agent_profile": { "type": ["string", "null"], "minLength": 1, "maxLength": 256 },
    "workflow_id": { "type": ["string", "null"], "minLength": 1, "maxLength": 256 },
    "session_id": { "type": ["string", "null"], "minLength": 1, "maxLength": 256 },
    "operation_id": { "type": ["string", "null"], "minLength": 1, "maxLength": 256 },
    "scope": { "enum": ["global", "project", "agent", "session", "workflow", "tool", "eval", "manual", "dox", "revolve"] },
    "ring": { "enum": ["cambium", "outer", "inner", "heartwood", "scar", "seed"] },
    "event_type": { "type": "string", "minLength": 1 },
    "summary": { "type": "string", "minLength": 1 },
    "details": { "type": "string" },
    "source": {
      "type": "object",
      "required": ["type"],
      "properties": {
        "type": { "type": "string", "minLength": 1 },
        "ref": { "type": "string" },
        "quote": { "type": "string" }
      },
      "additionalProperties": false
    },
    "tags": { "type": "array", "items": { "type": "string" } },
    "salience": { "type": "number", "minimum": 0, "maximum": 1 },
    "confidence": { "type": "number", "minimum": 0, "maximum": 1 },
    "sensitivity": { "enum": ["normal", "private", "secret", "health", "financial", "legal", "personal_identifier"] },
    "retention": { "enum": ["ephemeral", "normal", "durable", "user_pinned", "forget_after_date"] },
    "expires_at": { "type": ["string", "null"], "format": "date-time" },
    "supersedes": { "type": "array", "items": { "type": "string" } },
    "superseded_by": { "type": ["string", "null"] },
    "links": {
      "type": "array",
      "items": {
        "type": "object",
        "required": ["type", "target"],
        "properties": {
          "type": { "type": "string" },
          "target": { "type": "string" }
        },
        "additionalProperties": false
      }
    },
    "review": {
      "type": "object",
      "required": ["needs_review"],
      "properties": {
        "needs_review": { "type": "boolean" },
        "review_reason": { "type": ["string", "null"] },
        "reviewed_at": { "type": ["string", "null"] },
        "reviewed_by": { "type": ["string", "null"] }
      },
      "additionalProperties": false
    }
  },
  "allOf": [
    {
      "if": { "properties": { "scope": { "const": "agent" } }, "required": ["scope"] },
      "then": { "properties": { "agent_profile": { "type": "string", "minLength": 1 } }, "required": ["agent_profile"] }
    },
    {
      "if": { "properties": { "scope": { "const": "workflow" } }, "required": ["scope"] },
      "then": { "properties": { "workflow_id": { "type": "string", "minLength": 1 } }, "required": ["workflow_id"] }
    },
    {
      "if": { "properties": { "scope": { "const": "session" } }, "required": ["scope"] },
      "then": { "properties": { "session_id": { "type": "string", "minLength": 1 } }, "required": ["session_id"] }
    }
  ],
  "additionalProperties": false
}
